"StoreId","CompleteStoreName","FoodType","AverageRating","Reviewers","City","Location"
"w9to","G&B Bistro (Spago homemade Italian)","Pasta","3.9","(100+)","Singapore",""
"k4a5","Prata Alley (321 Alexandra)","Indian","4.5","(100+)","Singapore",""
"m36n","Western Wild Wild (601 Macpherson)","Western","5","(5)","Singapore",""
"px87","Ferns N Petals  - Cake Shop (444 Tagore Industrial Ave) - Restaurant Delivery","Cakes","3.7","(100+)","Singapore",""
"trdf","Bai Nian Niang Dou Fu (MacPherson Rd 601)","Chinese","4.7","(25)","Singapore",""
"py6p","OBOY! (Neil Road)","Sandwiches","4.7","(7)","Singapore",""
"x3wj","REBEL (Neil Road)","Sandwiches","4.6","(500+)","Singapore",""
"x4se","sofi cafe + keto & rooftop bar (Erskine Road)","Pizza","4.1","(100+)","Singapore",""
"x4br","Pasta Brava (Erskine Road)","Pasta","4.4","(86)","Singapore",""
"c7ca","Hong Kong Street Chun Tat Kee (Serangoon)","Chinese","4.3","(500+)","Singapore",""
"xvpl","Go2Eat (151 Serangoon North Ave 2)","Western","4.5","(100+)","Singapore",""
"w55k","Li Wei Vegetarian (151 SERANGOON NORTH AVE 2)","Vegetarian","4.4","(100+)","Singapore",""
"njhc","Danlao (Kadayanallur Street)","Asian","4.6","(100+)","Singapore",""
"iyya","ToMo Cafe (Neil Rd)","Western","5","(1)","Singapore",""
"pyrh","NangLen (Tanjong Pagar Road)","Thai","4.7","(9)","Singapore",""
"e5gy","BFF Fusion Fare 黄河麻辣美食 (KAP Mall)","Asian","5","(29)","Singapore",""
"x7fa","KL Traditional Chilli Ban Mee (Geylang)","Noodles","4.2","(100+)","Singapore",""
"x5je","Hua Kee Cooked Food (Geylang East Food Centre)","Noodles","4","(100+)","Singapore",""
"k1zv","Boon Tat Street BBQ Seafood (The Shoppes At Marina Bay Sands)","Chinese","2.9","(15)","Singapore",""
"mgsf","Tai Feng Wei Fusion (Grantral Mall)","Chinese","4.6","(100+)","Singapore",""
"whr6","Hong Style Fried Rice 四哥炒饭 (Circuit Road)","Chinese","5","(34)","Singapore",""
"z9qn","Haoju Ban Mian/Fish Soup/Pao Fan (Jalan Bukit Merah)","Noodles","4.4","(100+)","Singapore",""
"mftp","日日红麻辣香锅 Ririhong Malaxiangguo (Macpherson)","Asian","3.8","(3)","Singapore",""
"x8hy","Camaca (King Albert Park)","Cakes","4.1","(25)","Singapore",""
"ibp6","Somerset Delicacies (Maxwell Food Centre)","Chinese","5","(2)","Singapore",""
"i67l","Jufu Fishball Noodle (132 Jalan Bukit Merah)","Chinese","4.5","(9)","Singapore",""
"x5ry","Hong Tang Ma La Tang 红糖麻辣烫 (Macpherson Road)","Soups","4.2","(61)","Singapore",""
"sgfa","Kl Chicken Rice & Pork Leg Rice (Geylang Road)","Chicken Rice","4.4","(100+)","Singapore",""
"d3ih","XIAO LA MEI MALA XIANG GUO 小辣妹麻辣香锅 (118 Aljunied Ave 2)","Chinese","3.7","(3)","Singapore",""
"c8vn","Dong Sheng Japanese Korean Cuisine (151 Serangoon North Ave 2)","Seafood","4.3","(1000+)","Singapore",""
"y3eb","Xiao Ya Tou (Duxton Hill)","Chinese","3.8","(34)","Singapore",""
"p7er","WEIZHUANG (Aljunied Ave 2)","Soups","4.3","(78)","Singapore",""
"y8gg","Zhen Neng Zhu Ban Mian & Fish Soup 真能煮版面鱼汤 (115 Aljunied Ave 2)","Seafood","4.2","(100+)","Singapore",""
"tnfj","Fatty Wanton Mee (Serangoon North Avenue 2)","Chinese","4","(31)","Singapore",""
"inf9","Carrotsticks Stanley (5 Stanley St)","Healthy","4.9","(8)","Singapore",""
"fzgm","Miznon (Stanley Street)","Middle Eastern","4.8","(100+)","Singapore",""
"vqxy","Thachang SG (Telok Ayer)","Thai","4.6","(16)","Singapore",""
"wfby","Lao Huo Tang Chinese Mix Soup (Lau Pa Sat)","Soups","4.5","(100+)","Singapore",""
"y726","Qiao Yuan Fish Soup Ban Mian (Bukit Merah)","Chinese","4.5","(70)","Singapore",""
"v4gi","Arkadas Cafe  (Fusionopolis View)","Seafood","4","(100+)","Singapore",""
"rh80","Ding Wang Rojak & Min Jiang Kueh 鼎旺罗惹 & 麵煎粿 (Serangoon North Avenue 2)","Singaporean","4.5","(100+)","Singapore",""
"qmf4","Thunder Spize (Lau Pa Sat)","Japanese","3.9","(15)","Singapore",""
"w6cz","Chuan Xiang Le Mala (Bukit Timah Plaza)","Chinese","4.2","(100+)","Singapore",""
"w4rh","Chong Qin Xiao Mian (Paya Lebar)","Chinese","4.2","(100+)","Singapore",""
"w2xm","Kou Kou Xiang Clay Pot Rice (Geylang East Food Centre)","Chinese","4.5","(100+)","Singapore",""
"pnsh","Tipo Strada (Keong Saik)","Italian","4.6","(12)","Singapore",""
"z87i","Bu Zheng Zhong Hainanese Chicken Rice 不正宗海南鸡饭 (Bukit Merah Lane)","Chicken","4.7","(29)","Singapore",""
"o2jc","All 'Bout Chicken (Bukit Merah Lane)","Fried Chicken","5","(31)","Singapore",""
"jppo","Curry Rice & Bee Hoon (Ghim Moh)","4940 min","3.8","(11)","Singapore",""
"npbd","Fort Canning Big Prawn Noodle (Aljunied)","Malaysian","2.4","(12)","Singapore",""
"x9fs","Sabio Duxton (5 Duxton Hill)","Seafood","4.3","(14)","Singapore",""
"vc5t","Creme & Cone (Raffles Quay)","Dessert","5","(9)","Singapore",""
"x6hv","SRP Indian Muslim food (Clementi)","Indian","4.3","(1000+)","Singapore",""
"w5zg","Sumac (Rifle Range)","Indian","4.6","(100+)","Singapore",""
"z7py","Enchanted Cafe (24Hours) - Bukit Timah Plaza","Western","4.7","(100+)","Singapore",""
"jkrb","Gigi Gastrobar & Bistro (4 Marina Boulevard)","Italian","5","(25)","Singapore",""
"fxoo","Snap Cafe (McCallum Street)","4945 min","4.7","(3)","Singapore",""
"d0ii","17 BBQ (118 Aljunied Avenue)","Seafood","1","(1)","Singapore",""
"dioq","Jin Ho Spinach Soup (Lau Pa Sat)","Soups","4.6","(59)","Singapore",""
"x1bf","Munmun Street Cafe (Bukit Timah)","Singaporean","4.7","(100+)","Singapore",""
"sdi3","17 house of noodle (Aljunied Ave 2)","Singaporean","4.2","(6)","Singapore",""
"xoev","Al Habib Tandoori House (542B Serangoon)","Indian","3.4","(10)","Singapore",""
"zym3","IEat Kitchen (Lau Pa Sat)","Asian","4.1","(89)","Singapore",""
"tpi8","MaFe Bento (Koptiam @ Lau Pa Sat)","International","3.9","(10)","Singapore",""
"xahe","146 Famous Bukit Merah Ang Ku Kueh (Jalan Bukit Merah)","Chinese","4.5","(100+)","Singapore",""
"gaui","Le Petit Empire Designer Cakes (123 Bukit Merah) - Restaurant Delivery","Cakes","4.6","(51)","Singapore",""
"obuo","Grill By Cut (Bukit Timah Plaza)","Japanese","4.5","(73)","Singapore",""
"z3u8","Chef Goo (Bukit Merah Lane)","Hokkien Mee","4.7","(59)","Singapore",""
"gc82","Shuang Kitchen Ban Mian (Serangoon North Avenue 3)","Noodles","4.6","(100+)","Singapore",""
"x4o1","CHUAN WEI XIAO CHU 川味小厨 (546A Serangoon)","Chinese","4.4","(100+)","Singapore",""
"h13c","Kko Kko Na Ra (Tanjong Pagar)","Korean","4.3","(56)","Singapore",""
"qkdg","Legendary Fisherman (118 Aljunied Ave 2)","Chinese","4","(1)","Singapore",""
"y0kx","Love Fresh (Bukit Timah Plaza)","Japanese","4.7","(500+)","Singapore",""
"pz2o","Lao Chang Sha (18 Tai Seng St)","Chinese","2.8","(11)","Singapore",""
"ipyy","Hua Dee Hong Kong Roasted Delight (Lau Pa Sat)","Asian","4","(39)","Singapore",""
"v0dw","Dino Cake House & Cafe (Bukit Timah Plaza)","Cakes","4.7","(100+)","Singapore",""
"ocpd","MaFe Takibi (Koptiam @ Lau Pa Sat)","Japanese","4.4","(7)","Singapore",""
"iru8","Quintet Five (Bukit Timah Plaza)","Western","5","(21)","Singapore",""
"qm1e","190 Degrees Bakery (Bukit Merah)","Asian","4.8","(6)","Singapore",""
"j9mt","Maha Co. (Fusionopolis)","Mexican","1","(1)","Singapore",""
"v1p1","Yakiniku Don-Don 大阪焼肉 (Tanjong Pagar)","Japanese","3.5","(16)","Singapore",""
"ekzw","Populus Coffee & Food Co (Neil Road)","Western","5","(11)","Singapore",""
"xvam","The Gogijip Korean Charcoal BBQ (Tanjong Pagar)","Korean","4.6","(9)","Singapore",""
"c0bs","Qiang Sheng Fried Rice (134 Geylang East Ave 1)","Fried Rice","4.4","(100+)","Singapore",""
"h95r","Round Boy Roasters (Jalan Bukit Merah)","Coffee","5","(39)","Singapore",""
"w4lx","Urban Roti (Lau Pa Sat)","Indian","4.3","(500+)","Singapore",""
"h8jm","Cafe Wabi Sabi (Everton Park)","Japanese","2.3","(2)","Singapore",""
"i7ov","Amigo's (Lorong Ah Soo)","Western","4.7","(100+)","Singapore",""
"x6se","Took Lae Dee (Tai Seng Street)","Thai","4.6","(100+)","Singapore",""
"b9zj","Chengdu Bowl Flagship Store (Tanjong Pagar)","Chinese","4.4","(100+)","Singapore",""
"rmp6","Kungfu Mala Hotpot 功夫麻辣香锅 (Sakae Building)","Chinese","3.7","(28)","Singapore",""
"xyt4","Bag Me Up Bagel House (Everton Park)","German","3.1","(23)","Singapore",""
"f0fm","Sweetest Moments (Bread Talk IHQ)","Cakes","4.4","(23)","Singapore",""
"w1sw","Kajiken Ramen (Orchid Hotel)","Japanese","4.7","(500+)","Singapore",""
"makp","Lap Banh Mi (108 Depot Heights)","Vietnamese","3.9","(62)","Singapore",""
"kh09","Curry & Curry (Hougang Street)","Rice Dishes","3.3","(43)","Singapore",""
"cgyi","Delicatesse (102 Tanjong Pagar Rd) - Islandwide Delivery","Bakery","4.9","(9)","Singapore",""
"x1ml","Ya-Mahyuddin Al-Jailani Restaurant (Kampong Bahru)","Indian","4.4","(1000+)","Singapore",""
"n1nm","BLUEMIST (Tanjong Pagar Plaza)","Western","4.3","(41)","Singapore",""
"zod9","Mad Roaster (Depot Road)","Bakery","4.9","(11)","Singapore",""
"y6im","L32 handmade noodles (Geylang)","Noodles","4.5","(1000+)","Singapore",""
"y4ou","Rice House Vegetarian (Geylang East Avenue)","Vegetarian","4.3","(500+)","Singapore",""
"i3eb","Sukhothai Thai Boat Noodle (Orchid Hotel)","Thai","4.6","(100+)","Singapore",""
"s1uy","Anglo Indian Cafe & Bar (Shenton Way)","Indian","4.2","(100+)","Singapore",""
"y0cw","Paninoteca By D.O.C (Asia Square)","Italian","4.3","(62)","Singapore",""
"wlon","No. 17 Tea (Bukit Timah Shell)","Bubble Tea","4.7","(100+)","Singapore",""
"kkyn","ZAC'S BRIYANI (INDIAN FOOD PRATA THOSAI CURRY HOUSE)","Indian","4.2","(100+)","Singapore",""
"k1sh","Tea.J SG 茶匠 (Telok Blangah Crescent)","4945 min","4.9","(100+)","Singapore",""
"w7ke","Ha-Jun Korean (One North)","Korean","4.5","(100+)","Singapore",""
"x5jg","Kapitan (Maxwell Chambers)","Chinese","4.2","(76)","Singapore",""
"v0db","The Providore (Downtown Gallery)","Western","4.7","(62)","Singapore",""
"p9xl","Feng Tian Xiao Chu 奉天小厨 (Geylang Road)","Chinese","3.8","(100+)","Singapore",""
"kwa7","3 Meals A Day 一日三餐 (Block 121 HDB Hougang)","Chinese","4.6","(100+)","Singapore",""
"w3p7","Nana Banana (North Amenity Centre) - Islandwide Delivery","Indian","2","(4)","Singapore",""
"x1tc","Jalan Tua Kong Ya Lim Mee Pok (Telok Blangah)","Noodles","4.5","(1000+)","Singapore",""
"cgmu","Golden Scissors Curry Rice  - Old Airport Road Hawker Centre (51 Old Airport Rd)","Chinese","4.6","(16)","Singapore",""
"sdju","3 Meals A Day 一日三餐 Ban Mian & Fish Soup (121 Hougang Avenue 1)","Noodles","3.9","(100+)","Singapore",""
"s0zy","8 Degrees (Lowland Road)","Chinese","4.6","(1000+)","Singapore",""
"n0hh","Osteria (Asia Square Tower 2)","Pizza","4.7","(51)","Singapore",""
"x0md","Wok Palace (Fusionopolis Way)","Singaporean","4.5","(40)","Singapore",""
"ufpn","Winners Fried Chicken (Telok Blangah)","Fried Chicken","4.3","(500+)","Singapore",""
"h168","ZAINAP RESTAURANT PTE LTD (Bukit Merah)","Nasi Lemak","4","(100+)","Singapore",""
"x3ft","Teng Sheng Korean Cuisine (Serangoon North Ave)","Korean","4.2","(100+)","Singapore",""
"l7sy","Western Barbeque (Old Airport Road)","Chicken","4.4","(100+)","Singapore",""
"mcwv","OSA Kaki Fuyong (144 Upper Bukit Timah)","Japanese","4.9","(10)","Singapore",""
"u0by","Go Pasta (Bukit Timah Market & Food Centre)","Pasta","4.7","(100+)","Singapore",""
"qpwu","TIAN TIAN LE HAINANESE CHICKEN & CURRY RICE (144 Upper Bukit Timah)","Chicken","4.3","(11)","Singapore",""
"t0x5","Sarawak Noodle (Telok Blangah)","Noodles","2.9","(35)","Singapore",""
"aoxl","Makan Vegan 斋这里 (Geylang)","Vegetarian","4.9","(40)","Singapore",""
"azv9","Sheng xin fish head steamboat (Telok Blangah Cres)","Seafood","4.8","(16)","Singapore",""
"x3zd","3 Hainan Chicken Rice (Bukit Timah Market Food Centre)","Grill","4.5","(55)","Singapore",""
"s8xz","T Bob'S Corner (Tyrwhitt Road)","American","4.5","(500+)","Singapore",""
"w6fl","Aburi-EN (Tanjong Pagar Centre)","Japanese","4.6","(100+)","Singapore",""
"ffz0","Jia Yuen Creamy Salted Egg Rice (Maxwell Road)","Chinese","4.1","(17)","Singapore",""
"w4wd","RANDY INDULGENCE ACAI BAR (Guoco Tower)","Acai Bowl","4.7","(500+)","Singapore",""
"nf4h","Pho Me Vietnamese Beef Noodles (Old Airport Rd)","Asian","5","(1)","Singapore",""
"w7cx","Zhou Ji Mala Xiang Guo 周记麻辣香锅 (Telok Blangah)","Mala Xiang Guo","3.4","(1000+)","Singapore",""
"w9zt","SBCD Korean Tofu House (Tanjong Pagar Centre)","Korean","4.1","(100+)","Singapore",""
"zt3c","Tai Seng Herbal Soup  - Old Airport Road Hawker Centre (51 old Airport Rd)","Chicken","2.9","(18)","Singapore",""
"muqp","AH LOCK & CO (Wallich Street)","Rice Dishes","4.5","(100+)","Singapore",""
"ltvu","Original Simon Road Hokkien Mee (Telok Blangah Crescent Market & Food Centre)","Chinese","5","(1)","Singapore",""
"nyzy","L'Arte Pizza & Focaccia (Guoco Tower)","Pizza","4.8","(63)","Singapore",""
"y7eu","Ye Tang Chendol (Beauty World Centre)","Dessert","4.5","(18)","Singapore",""
"m33u","Island Bistro (Telok Blangah)","Asian","4.1","(24)","Singapore",""
"unmk","Munchi Pancakes Signatures! (Old Airport Rd)","Dessert","4.9","(19)","Singapore",""
"db6d","Yogiyo Korean (Beauty World Centre) - Islandwide Delivery","Korean","3.8","(34)","Singapore",""
"p3ex","133 Penang Authentic (Bukit Timah Market & Food Centre)","Noodles","4.8","(100+)","Singapore",""
"ci2u","Steamed Healthy Stewed Soup (Bukit Timah Market & Food Centre)","Soups","4.5","(60)","Singapore",""
"dpb8","Mom's Food (Beauty World Centre)","Korean","4","(25)","Singapore",""
"fb47","Nanyang Story (Upper Bukit Timah)","Curry","4.9","(8)","Singapore",""
"fp10","Bakes N Bites (Old Airport Road Food Centre)","Cakes","4.1","(7)","Singapore",""
"y4ue","May's Kafe (Beauty World Centre)","Singaporean","4.6","(500+)","Singapore",""
"xlct","Satefactory (Beauty World Centre)","Chicken Wings","4.5","(98)","Singapore",""
"oq2y","Sin Xiang Kee Pig's Organ Soup/Porridge/Braised (144 Upper Bukit Timah)","Singaporean","2.7","(3)","Singapore",""
"m82s","XIANG LE ROASTED DELIGHTS (Old Airport Road)","Chinese","4.6","(3)","Singapore",""
"l1fy","Yi Ji Fried Hokkien Prawn Mee (51 Old Airport Rd #01-102)","Hokkien Mee","4.5","(33)","Singapore",""
"l5fu","Freshly Made Chee Cheong Fun - Old Airport Road Hawker Centre (51 Old Airport Rd)","Singaporean","4.6","(74)","Singapore",""
"yahs","Yan Ji Seafood Soup (Old Airport Road) - Islandwide Delivery","Soups","4.6","(8)","Singapore",""
"b37d","Wang Nasi Lemak Kukus (Mt Faber)","Nasi Lemak","4.2","(100+)","Singapore",""
"z69k","Nan Yang Dao (Heartland Mall)","Malaysian","4.1","(100+)","Singapore",""
"bfuf","Mohammed Waseef Rojak ( Tanjong Rhu)","Chinese","5","(1)","Singapore",""
"tmsd","Chirashi-Ai (Beauty World Centre)","Rice Dishes","4","(52)","Singapore",""
"qlra","Korean Stir-Fry Pot (1 Tanjong Pagar Plaza)","Western","1.8","(3)","Singapore",""
"zpnw","SSADA GIMBAB (Upper Bukit Timah Road) - Islandwide Delivery","Korean","5","(40)","Singapore",""
"l7al","MenboLah! (Tanjong Pagar Plaza)","Korean","4.5","(100+)","Singapore",""
"g3fa","Wang Lao Wu Chicken King (Katong)","Chicken Rice","2.4","(39)","Singapore",""
"vcz4","Beiju Express (Icon Village)","Dessert","4.9","(14)","Singapore",""
"fj8q","Sona's Grill (Icon Village)","Indian","4.3","(90)","Singapore",""
"w9ho","Trung Nguyen Coffee (International Plaza)","Noodles","4.4","(100+)","Singapore",""
"w9rd","Tokyo Soba (Gopeng Street)","Japanese","4.6","(100+)","Singapore",""
"y2xs","Pin Yi Ban Mian (International Plaza)","Noodles","4.3","(100+)","Singapore",""
"kn4h","Yuan Ting Gourmet (209 Hougang St 21) - Islandwide Delivery","Porridge","4.4","(16)","Singapore",""
"y4rs","iTEA (Beauty World)","Bubble Tea","4.7","(100+)","Singapore",""
"owte","Ishiro Fusion Bowl (Timbre+) - Islandwide Delivery","Japanese","4.9","(6)","Singapore",""
"rbqg","The Summer Acai (Bukit Timah)","Acai Bowl","4.6","(100+)","Singapore",""
"st3w","Yu Lok Fan Hin III Vietnamese Cuisine (Tanjong Pagar Plaza)","Vietnamese","3.9","(14)","Singapore",""
"y3go","Old Habits Boutique & Cafe (Telok Blangah)","Western","4.7","(100+)","Singapore",""
"j21y","Nature Vegetarian Cuisine 大自然素食 (Bukit Purmei Road)","Singaporean","4.5","(100+)","Singapore",""
"w5oh","Al-Azhar Eating Restaurant (Cheong Chin Nam Road)","Indian","4.6","(3000+)","Singapore",""
"xrr4","Lola's Cafe (5 Simon Rd) - Islandwide Delivery","Cakes","4.5","(79)","Singapore",""
"e6cx","Omma Korean Charcoal BBQ (20 Cheong Chin Nam)","Korean","4.9","(7)","Singapore",""
"g4tm","Happy Cup (100 AM)","Tea","3.9","(69)","Singapore",""
"gph8","Ri Ri Hong Mala Hot Pot (91 Jalan Satu)","Chinese","5","(1)","Singapore",""
"om98","Xiang Pavilion 国色天湘 (Guo Se Tian Xiang) Hunan Signature - 100 AM - Islandwide Delivery","Chinese","5","(1)","Singapore",""
"iyub","Alkove Bistro (Simon Plaza)","French","5","(18)","Singapore",""
"w0wv","Chicken House (Kilat Court)","Fried Rice","4.5","(100+)","Singapore",""
"x5ev","Wanyoo Cyber Cafe (Beauty World)","Tea","2.6","(37)","Singapore",""
"eql1","YUN QIAN YI XIAN (云牵一线) (Upper Serangoon Rd )","Chinese","2","(13)","Singapore",""
"s3te","Laojiang Superior Soup (Cheong Chin Nam)","Soups","4.6","(2000+)","Singapore",""
"o7e2","Chennai House (263 Upper Thomson Rd) - Restaurant Delivery","Indian","3.4","(100+)","Singapore",""
"of04","Yi Jia Feng Wei (Bukit Permei Ville)","Chinese","4.4","(85)","Singapore",""
"wq69","Tenderfresh Classic (Cheong Chin Nam) - Islandwide Delivery","Western","4.4","(100+)","Singapore",""
"s5ld","Koon Bak Kut Teh (Cheong Chin Nam Road)","Bak Kut Teh","4.5","(1000+)","Singapore",""
"v0jr","Salmon Samurai (100Am)","Seafood","4.7","(2000+)","Singapore",""
"d3l6","Alice Boulangerie (Icon Village)","Bakery","4.9","(72)","Singapore",""
"n4tx","Waa Cow! (Marina One)","Rice Dishes","4.8","(100+)","Singapore",""
"p9fh","Olá Açaí (Hougang)","Acai Bowl","4.8","(100+)","Singapore",""
"setq","1981 Kelvin's Grill (Bukit Purmei Rd)","American","4.9","(7)","Singapore",""
"e0xb","No.5 Bukit Timah Live Bull Frog Claypot Porridge (Cheong Chin Nam Road)","Chinese","4.6","(86)","Singapore",""
"oyus","Mr. Baguette (Hougang) - Islandwide Delivery","Sandwiches","5","(1)","Singapore",""
"ss6a","Curry House (Upper Thomson Road) - Restaurant Delivery","Indian","3.2","(100+)","Singapore",""
"mrwd","Coexist Coffee Co. (LLI)","Coffee","4.9","(14)","Singapore",""
"xy6o","HAUS BAN MIAN (Paya Lebar Square)","Singaporean","4.7","(34)","Singapore",""
"ow3a","CURRY VILLAGE BANANA LEAF (8 Lim Teck Kim Rd) - Islandwide Delivery","Indian","4.8","(38)","Singapore",""
"pl6j","Italino (Modern Pasta Kitchen) - Islandwide Delivery","Pasta","5","(22)","Singapore",""
"x4pg","Yaowarat Thai Kway Chap (Upper Serangoon Road)","Thai","4.6","(1000+)","Singapore",""
"rv4c","Wow! Biryani (7 Hoe Chiang Rd)","Indian","4","(36)","Singapore",""
"v4bb","89.7 Supper Club (Geylang)","Singaporean","4.7","(20000+)","Singapore",""
"q940","Tandoor & Kebab Junction (Hoe Chiang Rd)","Chicken","3.9","(48)","Singapore",""
"n3w8","Daam Doom Dish (Tanjong Pagar)","Indian","2.3","(5)","Singapore",""
"bsm7","Haji S.M Hatheem Indian Muslim Food (Hougang)","Indian","4.7","(100+)","Singapore",""
"b6kn","Flip's N Dips (Paya Lebar)","Rice Dishes","4.2","(3000+)","Singapore",""
"gih1","Hai San Oc Dem (747 Geylang Road)","Vietnamese","4.6","(28)","Singapore",""
"a4tx","鸡煲之家 Chicken Claypot House (Geylang Road)","Chinese","4.2","(4)","Singapore",""
"wemk","First Street Teochew Fish Soup (973 Upper Serangoon Rd)","Soups","3.8","(100+)","Singapore",""
"s0wd","Tachinomiya Izakaya & Bar (Hougang)","Japanese","4.5","(500+)","Singapore",""
"wpro","Shun Quan Drinks (105 Hougang Avenue 1)","Beverages","4.5","(20)","Singapore",""
"x6yq","Yi Pin Ju 一品居 (Lim Teck Kim Road)","Chinese","4.1","(100+)","Singapore",""
"gqkv","MY CURRY RICE (GARDENS BY THE BAY)","Rice Dishes","2.9","(9)","Singapore",""
"c6bw","Mermaid 中国大排档 小鱼锅贴Chinese Cuisine – (745 Geylang Road)","Rice Dishes","4","(75)","Singapore",""
"nqdu","88 Pocha - Upp Serangoon (957 Upper Serangoon Rd)","Korean","3.5","(48)","Singapore",""
"fsdo","Chindamani Indian Restaurant (Hougang Ave)","Indian","4.5","(100+)","Singapore",""
"azhs","Thai Savoury (55 Serangoon North)","Thai","4.4","(100+)","Singapore",""
"nakp","Salted Caramel (Kilat Court)","Dessert","4.8","(35)","Singapore",""
"xny7","King Curry & Kebab Biryani Hub Tasty Authentic Curry And Kebab (Hoe Chiang Road)","Indian","5","(2)","Singapore",""
"v5uq","La Mei Spicy Hot Pot (210 Hougang Street 21)","Mala Xiang Guo","4.5","(1000+)","Singapore",""
"h5yj","Chicken Run (Paya Lebar Square)","Singaporean","4.5","(100+)","Singapore",""
"fytk","Fruicey (68 Jalan Jurong Kechil)","Beverages","4.9","(27)","Singapore",""
"gcpa","Flakyhaus (Hougang)","Dessert","5","(1)","Singapore",""
"v5tk","Madura's Restaurant (Paya Lebar)","Indian","4.2","(1000+)","Singapore",""
"r7ct","Steamed Gourmet (Kopitiam - PLQ)","Chinese","4.5","(500+)","Singapore",""
"d77q","Ya Hua Bak Kut Teh (Toh Yi Drive)","Soups","3.1","(47)","Singapore",""
"x1pj","Jiak Mee - Traditional Teochew Noodle (Hougang Ave 8)","Noodles","4.4","(100+)","Singapore",""
"x1vn","Yong Xing Teochew House (Paya Lebar Square)","Porridge","4.8","(100+)","Singapore",""
"zm9d","SMOKEY OAK (Guillemard Road)","Seafood","4.3","(5)","Singapore",""
"x5de","Western Mahua (PLQ)","Noodles","4.5","(100+)","Singapore",""
"bt9k","Holla Juice (Paya Lebar Square)","Beverages","4.9","(100+)","Singapore",""
"v2xx","J.CO Donuts & Coffee (Paya Lebar Square)","Dessert","4.8","(3000+)","Singapore",""
"w3sq","Bismillah Biryani (76 Shenton)","Indian","4.1","(500+)","Singapore",""
"v3zw","Kajiken (Paya Lebar Square)","Noodles","4.9","(500+)","Singapore",""
"x6pl","Honey Night (Guillemard Road)","Korean","4.5","(500+)","Singapore",""
"rjiv","Hyeongje Korean Fried Chicken Hyeongje 韩式炸鸡店  (KopiTime @ PLQ)","Chicken","4.4","(43)","Singapore",""
"xl4j","Pak Lum Malaysian Cuisine (Paya Lebar Rd)","Malaysian","2.3","(5)","Singapore",""
"ij6z","Sweet Symphony Dessert 甜多多 (Upper Serangoon Road)","Chinese","4.6","(100+)","Singapore",""
"dke9","Shiok Burger 新奇汉堡 (Paya Lebar Square)","Burgers","4.5","(94)","Singapore",""
"txk4","18 BBQ Seafood (Toh Yi Drive)","Seafood","5","(5)","Singapore",""
"hdc3","Lai Chi Mian (Bukit Timah)","Noodles","4.8","(40)","Singapore",""
"y1bt","21 Seafood (Hougang Street)","Seafood","4.2","(1000+)","Singapore",""
"jrio","Tai Wah Pork Noodle (107 Hougang)","Asian","4.2","(90)","Singapore",""
"m1e3","The Pasta Project (Stars of Kovan) - Islandwide Delivery","Pasta","3.4","(3)","Singapore",""
"vg3y","Cowpresso Coffee Roasters Singapore (Lor Kilat)","Coffee","4.1","(16)","Singapore",""
"y0lk","iPOT Mala Tri-Pot 麻辣三锅 (PLS)","Mala Xiang Guo","4.4","(100+)","Singapore",""
"b4tp","Edo Shukudo (PLQ Mall)","Japanese","3.4","(4)","Singapore",""
"x1qv","Krispy Kreme (PLQ)","Donut","4.6","(1000+)","Singapore",""
"x5gf","Shanghai Family Restaurant (Geylang Road)","Chinese","4.2","(500+)","Singapore",""
"m4cx","SOI 72 Thai Bistro (Grandlink Square)","Thai","4.4","(100+)","Singapore",""
"wtfa","Zhang Liang Mala Tang 张亮麻辣烫 (PLQ Mall 店）","Mala Xiang Guo","4.5","(100+)","Singapore",""
"wo6e","Geláre (Paya Lebar Square)","Dessert","4.5","(94)","Singapore",""
"fygt","Delibowl 壹碗巴耶利峇广场 (Paya Lebar Square) - Islandwide Delivery","Chinese","2.9","(13)","Singapore",""
"g7o7","The Pizza Project (Stars of Kovan)","Pizza","4.5","(26)","Singapore",""
"b0ls","Redberry Bakery (Hougang)","Pancakes and Waffles","4.4","(78)","Singapore",""
"i1oo","QIN JI ROUGAMO 秦记肉夹馍 (Paya Lebar Square)","Chinese","4.8","(100+)","Singapore",""
"d521","Riverside Sichuan BBQ (Guillemard Road)","Asian","5","(1)","Singapore",""
"x7rg","Handlebar (Gilman Barracks)","American","4.4","(66)","Singapore",""
"x5vl","Paradise Dynasty (Paya Lebar)","Chinese","4.6","(2000+)","Singapore",""
"y2kn","Grove (Singpost Centre)","Malaysian","4.5","(500+)","Singapore",""
"wgen","Zheng Kampong Hainanese Chicken Rice (Singapura Heritage Singpost Centre)","Chicken","4.9","(10)","Singapore",""
"y7sm","Hong Fa Handmade Noodles (644 Hougang Avenue 8)","Noodles","4.3","(100+)","Singapore",""
"oipz","Kopifellas Kiosk (Oasis)","Singaporean","5","(2)","Singapore",""
"mrt1","Zhen Jie Prawn Noodle (Singpost Centre)","Soups","4","(27)","Singapore",""
"fzjx","Yakiniku Like (PLQ Mall) - Islandwide Delivery","Japanese","3.9","(4)","Singapore",""
"ic9b","Singapura Heritage (Singpost Centre)","Singaporean","4.5","(100+)","Singapore",""
"sol2","Vitality Braised Pot 元气小焖锅 (Paya Lebar Rd)","Chinese","3.9","(11)","Singapore",""
"o1v8","Jai Siam (Paya Lebar)","Seafood","4.1","(100+)","Singapore",""
"huws","Simply D&H Western Cuisine (Ang Mo Kio)","Western","4.3","(100+)","Singapore",""
"fhrd","Heng Heng Curry Rice (Singpost Centre)","Curry","4.7","(100+)","Singapore",""
"l1mr","Cui Xiang Yuan Restaurant (Telok Blangah Heights)","Chinese","4.4","(100+)","Singapore",""
"q3bi","New Thai Kitchen & Thai Paradise (Hougang)","Thai","4.9","(27)","Singapore",""
"b0af","Super Coconut (Hougang 1)","Beverages","4.6","(100+)","Singapore",""
"cv86","Lao Wei Dao Yong Tau Foo (PLQ)","Asian","4.6","(9)","Singapore",""
"i008","Salmon Warrior (Singpost Centre)","Japanese","4.3","(100+)","Singapore",""
"nazs","Bibimbap! (SingPost)","Korean","4.4","(100+)","Singapore",""
"c97n","Yi Dian Xin Hong Kong Dim Sum (Kovan) - Islandwide Delivery","Dim Sum ","4.5","(56)","Singapore",""
"jply","恩 Live Seafood Restaurant (Psa Pass Centre)","Seafood","3.6","(2)","Singapore",""
"pd9u","Chewy Junior Luxe (SingPost Centre)","Dessert","4.9","(71)","Singapore",""
"gwq7","Delifrance (SingPost Centre)","French","4.9","(24)","Singapore",""
"mucp","My Curry Rice (PLQ)","4950 min","4.3","(6)","Singapore",""
"v9wd","Cake Avenue (Halal)","Cakes","4.7","(100+)","Singapore",""
"oqfa","Tamoya Udon & Tempura Singapore (Eunos Road 8)","Japanese","4.4","(49)","Singapore",""
"ftb0","Happiness 31 Bolo Bun (Eunos Rd)","Cakes","4.5","(56)","Singapore",""
"x4kh","FlagWhite (Jalan Jurong Kechil)","American","4.8","(100+)","Singapore",""
"qmr0","Koo Kee (SingPost Centre)","Noodles","4.5","(500+)","Singapore",""
